{
  "schema_version": 2,
  "project": "token_igsm",
  "round_id": "2026-07-22-igsm-124m-corrected-2xa100",
  "decision": "Run the corrected matched-scale token-iGSM comparison on two A100s per model. Every model receives 51.2M fresh traces, 100,000 optimizer updates, global batch 512, bf16, LR 2e-3, and matched milestone checkpoints. The JEPA variants use sequence packing, one-step causal latent prediction, EMA targets, VICReg, and a fixed global GAR anchor budget; they differ only in whether token-prior training is enabled.",
  "git_commit": "edc02a2dfdb38c5303b0c720c33a44a0d1eeb4e3",
  "jobs": [
    {
      "id": "igsm-124m-token-lm-corrected-2xa100-s0",
      "cluster": "Lise",
      "partition": "gpu-a100:shared",
      "gpus": 2,
      "cpus": 16,
      "min_gpu_memory_mb": 75000,
      "walltime_minutes": 1440,
      "env": {"WORLD_GPUS": "2", "OMP_NUM_THREADS": "4"},
      "purpose": "Train the 123.93M decoder-only token LM baseline at physical batch 256 per rank and global batch 512.",
      "command": ["bash", "scripts/run_igsm_124m_scale.sh", "{python}", "token_lm", "igsm-124m-token-lm-corrected-2xa100-s0"],
      "expected_artifacts": ["model/last.pt", "model/checkpoint-examples-000204800.pt", "model/checkpoint-examples-51200000.pt", "metrics.json", "stdout.log"]
    },
    {
      "id": "igsm-124m-sentence-lm-corrected-2xa100-s0",
      "cluster": "Lise",
      "partition": "gpu-a100:shared",
      "gpus": 2,
      "cpus": 16,
      "min_gpu_memory_mb": 75000,
      "walltime_minutes": 1440,
      "env": {"WORLD_GPUS": "2", "OMP_NUM_THREADS": "4"},
      "purpose": "Train the 123.21M sentence-latent CE-only baseline at physical batch 256 per rank and global batch 512.",
      "command": ["bash", "scripts/run_igsm_124m_scale.sh", "{python}", "sentence_lm", "igsm-124m-sentence-lm-corrected-2xa100-s0"],
      "expected_artifacts": ["model/last.pt", "model/checkpoint-examples-000204800.pt", "model/checkpoint-examples-51200000.pt", "metrics.json", "stdout.log"]
    },
    {
      "id": "igsm-124m-jepa-prior-corrected-2xa100-s0",
      "cluster": "Lise",
      "partition": "gpu-a100:shared",
      "gpus": 2,
      "cpus": 16,
      "min_gpu_memory_mb": 75000,
      "walltime_minutes": 1440,
      "env": {"WORLD_GPUS": "2", "OMP_NUM_THREADS": "4"},
      "purpose": "Train the 123.32M packed one-step pooled JEPA with EMA, VICReg, GAR, and its learned token prior at physical batch 256 per rank.",
      "command": ["bash", "scripts/run_igsm_124m_scale.sh", "{python}", "jepa_prior", "igsm-124m-jepa-prior-corrected-2xa100-s0"],
      "expected_artifacts": ["model/last.pt", "model/checkpoint-examples-000204800.pt", "model/checkpoint-examples-51200000.pt", "metrics.json", "stdout.log"]
    },
    {
      "id": "igsm-124m-jepa-no-prior-corrected-2xa100-s0",
      "cluster": "Lise",
      "partition": "gpu-a100:shared",
      "gpus": 2,
      "cpus": 16,
      "min_gpu_memory_mb": 75000,
      "walltime_minutes": 1440,
      "env": {"WORLD_GPUS": "2", "OMP_NUM_THREADS": "4"},
      "purpose": "Train the otherwise identical packed one-step pooled JEPA without the token-prior module or loss.",
      "command": ["bash", "scripts/run_igsm_124m_scale.sh", "{python}", "jepa_no_prior", "igsm-124m-jepa-no-prior-corrected-2xa100-s0"],
      "expected_artifacts": ["model/last.pt", "model/checkpoint-examples-000204800.pt", "model/checkpoint-examples-51200000.pt", "metrics.json", "stdout.log"]
    }
  ]
}
