{
  "schema_version": 2,
  "project": "sequence_edit",
  "round_id": "2026-07-24-optimized-sentence-gar-k8-segment1",
  "decision": "First exact segment of the repaired 124M sentence K=8 GAR run. Stop after 20,000 of a fixed 40,000-update schedule, periodically save full optimizer checkpoints, and preserve the deterministic in-epoch sampler position for continuation.",
  "git_commit": "31f2fc6b6c7f2e4072d79cf35f4d3bd7a38caf18",
  "jobs": [
    {
      "id": "edit-optimized-sentence-gar-k8-124m-b256-40k-segment1-s0",
      "cluster": "gruenau",
      "command": [
        "bash",
        "scripts/run_multiscale_edit_cell.sh",
        "{python}",
        "edit_igsm_original_sentence_gar",
        "0",
        "train.max_steps=40000",
        "train.stop_after_steps=20000",
        "train.checkpoint_every_steps=1000",
        "train.batch_size=256",
        "train.microbatch_size=256",
        "train.eval_batch_size=8",
        "train.num_workers=4",
        "train.eval_batches=64",
        "train.log_every=50",
        "data.train_size=10240000",
        "data.val_size=4096",
        "model.sequence_packing=true",
        "objective.sigreg.weight=0.0",
        "objective.multiscale_vicreg.weight=0.02"
      ],
      "gpus": 1,
      "walltime_minutes": 1440,
      "node": 10,
      "min_gpu_memory_mb": 80000,
      "cpus": 8,
      "purpose": "Checkpoint-safe first half of the exact timeout recovery; no changed model, data, objective, or schedule.",
      "expected_artifacts": [
        "model/last.pt",
        "model/best.pt",
        "model/metrics.csv"
      ]
    }
  ]
}
