{
  "schema_version": 2,
  "project": "token_igsm",
  "round_id": "2026-07-22-igsm-124m-throughput-gate-v4",
  "decision": "Submit only the four no-prior JEPA throughput cells left unaccepted after the Grete snapshot-sync interruption.",
  "git_commit": "0142146e98ec1b767fadfd6280e3590a207b3058",
  "jobs": [
    {"id":"bench-jepa-no-prior-mb2","cluster":"Lise","gpus":1,"cpus":8,"min_gpu_memory_mb":75000,"walltime_minutes":60,"purpose":"Full GAR+dense objective throughput gate.","command":["bash","scripts/run_igsm_124m_benchmark.sh","{python}","jepa_no_prior","2"],"expected_artifacts":["benchmark.json","stdout.log"]},
    {"id":"bench-jepa-no-prior-mb4","cluster":"Lise","gpus":1,"cpus":8,"min_gpu_memory_mb":75000,"walltime_minutes":60,"purpose":"Full GAR+dense objective throughput gate.","command":["bash","scripts/run_igsm_124m_benchmark.sh","{python}","jepa_no_prior","4"],"expected_artifacts":["benchmark.json","stdout.log"]},
    {"id":"bench-jepa-no-prior-mb8","cluster":"Lise","gpus":1,"cpus":8,"min_gpu_memory_mb":75000,"walltime_minutes":60,"purpose":"Full GAR+dense objective throughput gate.","command":["bash","scripts/run_igsm_124m_benchmark.sh","{python}","jepa_no_prior","8"],"expected_artifacts":["benchmark.json","stdout.log"]},
    {"id":"bench-jepa-no-prior-mb16","cluster":"Lise","gpus":1,"cpus":8,"min_gpu_memory_mb":75000,"walltime_minutes":60,"purpose":"Full GAR+dense objective throughput gate.","command":["bash","scripts/run_igsm_124m_benchmark.sh","{python}","jepa_no_prior","16"],"expected_artifacts":["benchmark.json","stdout.log"]}
  ]
}
